{"schema_version":"1.0","profile_id":"LS-RETENTION-PROFILE-FIXTURE-001","profile_version":"1.0-fixture","effective_at":"2026-10-04T15:00:00Z","retention_period_days":365,"archive_read_roles":["PRODUCT_OWNER","PASSPORT_ADMIN","AUDITOR"],"review_owner_id":"ARCHIVE-OWNER-FIXTURE","legal_hold_authorities":["PASSPORT_ADMIN","LEGAL_OWNER"],"configured_by":"SYSTEM-OWNER-FIXTURE","approved_by":"PRODUCT-OWNER-FIXTURE","profile_sha256":"6666666666666666666666666666666666666666666666666666666666666666"}
